URL,TITLE,DES
https://www.youtube.com/embed/cJYUWCmQFuw?si=I3CfMfiCHyDP6vaJ,“黃金豆皮”拚千萬年收 ｜源品香豆皮廠｜【台灣真善美】2025.04.06,餐桌上的家常料理豆皮，在日本有一個很美的名字取作湯葉，把豆漿上頭凝結的薄膜輕柔取起，再層層堆疊，作工繁複，在台灣因濁水溪的水質，特別適合，目前約有七成的豆皮來自雲林莿桐。當地製作豆皮二十年的林昇添，只用非基改黃豆研磨豆漿，不添加防腐劑和漂白劑，做出來的豆皮，口感Q軟香濃，還外銷美國、香港等地，年營收破千萬元。當地農會還將他的豆皮，包裝成法國麵包來行銷。
https://www.youtube.com/embed/j1p14kItLCY?si=vPSBV2IqD4UmAYvQ,【行仔內ê話】EP46 雲林莿桐-豆皮,大家最喜歡的豆皮竟然是....跟我分享最喜歡豆皮做成甚麼料理吧~
https://www.youtube.com/embed/zl1uCexGuSo?si=2n5b2ViL57PgW-Mv,雲林手工豆皮生產工廠 - 台灣美食,
https://www.youtube.com/embed/FNhBYFON6MY?si=EDLV5F2q71DdzdUO,雲林農業翻轉中 莿桐豆皮攻歐美市場,餐桌上常見的豆皮、腐皮，便宜又美味，而全台灣有70%的豆皮，都出自於雲林，原因是濁水溪富含石灰質，讓豆漿更容易凝結，現在雲林的莿桐農會將豆皮重新包裝，不僅進軍電商，更開創歐美市場。
https://www.youtube.com/embed/sJTA1a3BNXg?si=DIH2_1L-Ja9rjY3f,鼎王指定豆皮 外銷歐美年收千萬|171202台灣向錢衝,
https://www.youtube.com/embed/7SO3Pgrl3Tc?si=jyMQT0AnGjiFrxVf,農會推非基改豆皮 搶攻頂級市場|雲林新聞網,雲林縣莿桐鄉和西螺鎮，出產豆皮、豆包產量佔全國70%，卻只是代工，現在莿桐鄉農會和優質業者攜手合作，創造在地品牌，推出市面較罕見的非基改腐竹包裝，要搶攻頂級市場客源，期待藉由打造莿桐豆皮優質形象，讓民眾想買豆製品，想到是莿桐鄉。
〈以上新聞可從哈TV APP收視〉